{"$schema":"https://json-schema.org/draft/2020-12/schema","$id":"https://thekey.local/schemas/governed-transaction-v1.json","title":"GovernedTransaction v1","type":"object","additionalProperties":false,"required":["schema_version","protocol_version","transaction_id","run_id","plan_sha256","actor_id","authorization_id","review_receipt_id","policy_version","policy_bundle_hash","requested_at"],"properties":{"schema_version":{"const":"v1"},"protocol_version":{"const":"v1"},"transaction_id":{"type":"string","minLength":3,"maxLength":128},"run_id":{"type":"string","minLength":3,"maxLength":128},"plan_sha256":{"type":"string","pattern":"^(?!0{64}$)[0-9a-f]{64}$"},"actor_id":{"type":"string","minLength":1,"maxLength":128},"authorization_id":{"type":"string","minLength":3,"maxLength":128},"review_receipt_id":{"type":"string","minLength":3,"maxLength":128},"policy_version":{"type":"string","minLength":1,"maxLength":64},"policy_bundle_hash":{"type":"string","pattern":"^(?!0{64}$)[0-9a-f]{64}$"},"requested_at":{"type":"string","format":"date-time"}}}
